[Init] Inputs : eta=0.20, epsilon=1.00, r=1.00
[Init] LSH Parameters : w=3.772, p1=0.7885, p2=0.5891, rho=0.4491
[Init] Data Structure Parameters : k=17, L=71, key_bits=544, mode=speed
[Build] Starting insertion...
[Build] Inserted 100/8000 points, avg insert time (ms): 0.198
[Build] Inserted 200/8000 points, avg insert time (ms): 0.158
[Build] Inserted 300/8000 points, avg insert time (ms): 0.232
[Build] Inserted 400/8000 points, avg insert time (ms): 0.146
[Build] Inserted 500/8000 points, avg insert time (ms): 0.077
[Build] Inserted 600/8000 points, avg insert time (ms): 0.088
[Build] Inserted 700/8000 points, avg insert time (ms): 0.120
[Build] Inserted 800/8000 points, avg insert time (ms): 0.089
[Build] Inserted 900/8000 points, avg insert time (ms): 0.127
[Build] Inserted 1000/8000 points, avg insert time (ms): 0.103
[Build] Inserted 1100/8000 points, avg insert time (ms): 0.118
[Build] Inserted 1200/8000 points, avg insert time (ms): 0.125
[Build] Inserted 1300/8000 points, avg insert time (ms): 0.100
[Build] Inserted 1400/8000 points, avg insert time (ms): 0.169
[Build] Inserted 1500/8000 points, avg insert time (ms): 0.116
[Build] Inserted 1600/8000 points, avg insert time (ms): 0.138
[Build] Inserted 1700/8000 points, avg insert time (ms): 0.241
[Build] Inserted 1800/8000 points, avg insert time (ms): 0.109
[Build] Inserted 1900/8000 points, avg insert time (ms): 0.126
[Build] Inserted 2000/8000 points, avg insert time (ms): 0.132
[Build] Inserted 2100/8000 points, avg insert time (ms): 0.135
[Build] Inserted 2200/8000 points, avg insert time (ms): 0.098
[Build] Inserted 2300/8000 points, avg insert time (ms): 0.082
[Build] Inserted 2400/8000 points, avg insert time (ms): 0.115
[Build] Inserted 2500/8000 points, avg insert time (ms): 0.090
[Build] Inserted 2600/8000 points, avg insert time (ms): 0.109
[Build] Inserted 2700/8000 points, avg insert time (ms): 0.113
[Build] Inserted 2800/8000 points, avg insert time (ms): 0.111
[Build] Inserted 2900/8000 points, avg insert time (ms): 0.119
[Build] Inserted 3000/8000 points, avg insert time (ms): 0.120
[Build] Inserted 3100/8000 points, avg insert time (ms): 0.105
[Build] Inserted 3200/8000 points, avg insert time (ms): 0.118
[Build] Inserted 3300/8000 points, avg insert time (ms): 0.147
[Build] Inserted 3400/8000 points, avg insert time (ms): 0.120
[Build] Inserted 3500/8000 points, avg insert time (ms): 0.141
[Build] Inserted 3600/8000 points, avg insert time (ms): 0.054
[Build] Inserted 3700/8000 points, avg insert time (ms): 0.113
[Build] Inserted 3800/8000 points, avg insert time (ms): 0.081
[Build] Inserted 3900/8000 points, avg insert time (ms): 0.115
[Build] Inserted 4000/8000 points, avg insert time (ms): 0.115
[Build] Inserted 4100/8000 points, avg insert time (ms): 0.094
[Build] Inserted 4200/8000 points, avg insert time (ms): 0.120
[Build] Inserted 4300/8000 points, avg insert time (ms): 0.125
[Build] Inserted 4400/8000 points, avg insert time (ms): 0.112
[Build] Inserted 4500/8000 points, avg insert time (ms): 0.125
[Build] Inserted 4600/8000 points, avg insert time (ms): 0.129
[Build] Inserted 4700/8000 points, avg insert time (ms): 0.109
[Build] Inserted 4800/8000 points, avg insert time (ms): 0.047
[Build] Inserted 4900/8000 points, avg insert time (ms): 0.123
[Build] Inserted 5000/8000 points, avg insert time (ms): 0.085
[Build] Inserted 5100/8000 points, avg insert time (ms): 0.140
[Build] Inserted 5200/8000 points, avg insert time (ms): 0.094
[Build] Inserted 5300/8000 points, avg insert time (ms): 0.105
[Build] Inserted 5400/8000 points, avg insert time (ms): 0.105
[Build] Inserted 5500/8000 points, avg insert time (ms): 0.139
[Build] Inserted 5600/8000 points, avg insert time (ms): 0.087
[Build] Inserted 5700/8000 points, avg insert time (ms): 0.119
[Build] Inserted 5800/8000 points, avg insert time (ms): 0.087
[Build] Inserted 5900/8000 points, avg insert time (ms): 0.102
[Build] Inserted 6000/8000 points, avg insert time (ms): 0.111
[Build] Inserted 6100/8000 points, avg insert time (ms): 0.122
[Build] Inserted 6200/8000 points, avg insert time (ms): 0.123
[Build] Inserted 6300/8000 points, avg insert time (ms): 0.124
[Build] Inserted 6400/8000 points, avg insert time (ms): 0.225
[Build] Inserted 6500/8000 points, avg insert time (ms): 0.102
[Build] Inserted 6600/8000 points, avg insert time (ms): 0.127
[Build] Inserted 6700/8000 points, avg insert time (ms): 0.075
[Build] Inserted 6800/8000 points, avg insert time (ms): 0.113
[Build] Inserted 6900/8000 points, avg insert time (ms): 0.126
[Build] Inserted 7000/8000 points, avg insert time (ms): 0.116
[Build] Inserted 7100/8000 points, avg insert time (ms): 0.100
[Build] Inserted 7200/8000 points, avg insert time (ms): 0.088
[Build] Inserted 7300/8000 points, avg insert time (ms): 0.128
[Build] Inserted 7400/8000 points, avg insert time (ms): 0.133
[Build] Inserted 7500/8000 points, avg insert time (ms): 0.094
[Build] Inserted 7600/8000 points, avg insert time (ms): 0.094
[Build] Inserted 7700/8000 points, avg insert time (ms): 0.113
[Build] Inserted 7800/8000 points, avg insert time (ms): 0.167
[Build] Inserted 7900/8000 points, avg insert time (ms): 0.161
[Build] Inserted 8000/8000 points, avg insert time (ms): 0.089
[Timing] Total insertion time: 1.01 s
[Build] Starting queries...
[Query] Processed 1/1 queries, avg query time (ms): 4.158
[Timing] Total query time: 0.00 s
[Eval] Computing ground truth top-K...
[Timing] Ground truth (FAISS): 0.00 s (0.443 ms/query)
[Timing] Ground truth computation: 0.13 s
[Eval] Computing recall metrics...
[Timing] Recall evaluation: 0.00 s
[Eval] Computing (c,r)-ANN accuracy...
[Timing] FAISS r* computation: 0.00 s (0.294 ms/query)
[CR-ANN] 1/1 processed, avg time (ann.query): 13.919 ms
[Timing] (c,r)-ANN eval: 0.01 s (14.402 ms/query)
[Sanity Check] Total Relevant = 1
[Timing] (c,r)-ANN evaluation: 0.02 s
[Result] Memory breakdown (MB): {'hash_functions_MB': 0.6031684875488281, 'bucket_ids_MB': 0.3637428283691406, 'num_ids': 95353, 'num_buckets': 5094, 'hash_tables_overhead_MB': 0.4275054931640625, 'total_MB': 1.3944168090820312}
[Result] Epsilon-recall: 1.0000
[Result] (c,r)-ANN accuracy: 1.0000

[Timing Summary]
  Insert phase: 1.01 s
  Query phase: 0.00 s
  Ground truth: 0.13 s
  Recall eval: 0.00 s
  (c,r)-ANN eval: 0.02 s
  Total time: 1.16 s
[SUMMARY] r=1.0, eps=1.0, eta=0.2, recall=1.0000, (c,r)-ANN accuracy=1.0, memory=1.3944168090820312
