[Init] Inputs : eta=0.30, epsilon=0.50, r=1.00
[Init] LSH Parameters : w=3.154, p1=0.7472, p2=0.6267, rho=0.6236
[Init] Data Structure Parameters : k=20, L=363, key_bits=640, mode=speed
[Build] Starting insertion...
[Build] Inserted 100/8000 points, avg insert time (ms): 0.392
[Build] Inserted 200/8000 points, avg insert time (ms): 0.086
[Build] Inserted 300/8000 points, avg insert time (ms): 0.281
[Build] Inserted 400/8000 points, avg insert time (ms): 0.270
[Build] Inserted 500/8000 points, avg insert time (ms): 0.209
[Build] Inserted 600/8000 points, avg insert time (ms): 0.594
[Build] Inserted 700/8000 points, avg insert time (ms): 0.166
[Build] Inserted 800/8000 points, avg insert time (ms): 0.278
[Build] Inserted 900/8000 points, avg insert time (ms): 0.335
[Build] Inserted 1000/8000 points, avg insert time (ms): 0.213
[Build] Inserted 1100/8000 points, avg insert time (ms): 0.195
[Build] Inserted 1200/8000 points, avg insert time (ms): 0.523
[Build] Inserted 1300/8000 points, avg insert time (ms): 0.256
[Build] Inserted 1400/8000 points, avg insert time (ms): 0.312
[Build] Inserted 1500/8000 points, avg insert time (ms): 0.370
[Build] Inserted 1600/8000 points, avg insert time (ms): 0.165
[Build] Inserted 1700/8000 points, avg insert time (ms): 0.126
[Build] Inserted 1800/8000 points, avg insert time (ms): 0.330
[Build] Inserted 1900/8000 points, avg insert time (ms): 0.370
[Build] Inserted 2000/8000 points, avg insert time (ms): 0.318
[Build] Inserted 2100/8000 points, avg insert time (ms): 0.833
[Build] Inserted 2200/8000 points, avg insert time (ms): 0.272
[Build] Inserted 2300/8000 points, avg insert time (ms): 0.496
[Build] Inserted 2400/8000 points, avg insert time (ms): 0.161
[Build] Inserted 2500/8000 points, avg insert time (ms): 0.723
[Build] Inserted 2600/8000 points, avg insert time (ms): 0.589
[Build] Inserted 2700/8000 points, avg insert time (ms): 0.331
[Build] Inserted 2800/8000 points, avg insert time (ms): 0.480
[Build] Inserted 2900/8000 points, avg insert time (ms): 0.356
[Build] Inserted 3000/8000 points, avg insert time (ms): 0.384
[Build] Inserted 3100/8000 points, avg insert time (ms): 0.148
[Build] Inserted 3200/8000 points, avg insert time (ms): 0.303
[Build] Inserted 3300/8000 points, avg insert time (ms): 0.321
[Build] Inserted 3400/8000 points, avg insert time (ms): 0.456
[Build] Inserted 3500/8000 points, avg insert time (ms): 0.232
[Build] Inserted 3600/8000 points, avg insert time (ms): 0.317
[Build] Inserted 3700/8000 points, avg insert time (ms): 0.278
[Build] Inserted 3800/8000 points, avg insert time (ms): 0.251
[Build] Inserted 3900/8000 points, avg insert time (ms): 0.340
[Build] Inserted 4000/8000 points, avg insert time (ms): 0.319
[Build] Inserted 4100/8000 points, avg insert time (ms): 0.329
[Build] Inserted 4200/8000 points, avg insert time (ms): 0.364
[Build] Inserted 4300/8000 points, avg insert time (ms): 0.162
[Build] Inserted 4400/8000 points, avg insert time (ms): 0.172
[Build] Inserted 4500/8000 points, avg insert time (ms): 0.233
[Build] Inserted 4600/8000 points, avg insert time (ms): 0.403
[Build] Inserted 4700/8000 points, avg insert time (ms): 0.396
[Build] Inserted 4800/8000 points, avg insert time (ms): 0.353
[Build] Inserted 4900/8000 points, avg insert time (ms): 0.195
[Build] Inserted 5000/8000 points, avg insert time (ms): 0.307
[Build] Inserted 5100/8000 points, avg insert time (ms): 0.235
[Build] Inserted 5200/8000 points, avg insert time (ms): 0.438
[Build] Inserted 5300/8000 points, avg insert time (ms): 0.226
[Build] Inserted 5400/8000 points, avg insert time (ms): 0.166
[Build] Inserted 5500/8000 points, avg insert time (ms): 0.404
[Build] Inserted 5600/8000 points, avg insert time (ms): 0.118
[Build] Inserted 5700/8000 points, avg insert time (ms): 0.245
[Build] Inserted 5800/8000 points, avg insert time (ms): 0.560
[Build] Inserted 5900/8000 points, avg insert time (ms): 0.466
[Build] Inserted 6000/8000 points, avg insert time (ms): 0.195
[Build] Inserted 6100/8000 points, avg insert time (ms): 0.313
[Build] Inserted 6200/8000 points, avg insert time (ms): 0.424
[Build] Inserted 6300/8000 points, avg insert time (ms): 0.192
[Build] Inserted 6400/8000 points, avg insert time (ms): 0.154
[Build] Inserted 6500/8000 points, avg insert time (ms): 0.119
[Build] Inserted 6600/8000 points, avg insert time (ms): 0.282
[Build] Inserted 6700/8000 points, avg insert time (ms): 0.239
[Build] Inserted 6800/8000 points, avg insert time (ms): 0.330
[Build] Inserted 6900/8000 points, avg insert time (ms): 0.351
[Build] Inserted 7000/8000 points, avg insert time (ms): 0.390
[Build] Inserted 7100/8000 points, avg insert time (ms): 0.331
[Build] Inserted 7200/8000 points, avg insert time (ms): 0.290
[Build] Inserted 7300/8000 points, avg insert time (ms): 0.237
[Build] Inserted 7400/8000 points, avg insert time (ms): 0.231
[Build] Inserted 7500/8000 points, avg insert time (ms): 0.190
[Build] Inserted 7600/8000 points, avg insert time (ms): 0.338
[Build] Inserted 7700/8000 points, avg insert time (ms): 0.132
[Build] Inserted 7800/8000 points, avg insert time (ms): 0.372
[Build] Inserted 7900/8000 points, avg insert time (ms): 0.470
[Build] Inserted 8000/8000 points, avg insert time (ms): 0.325
[Timing] Total insertion time: 2.61 s
[Build] Starting queries...
[Query] Processed 1/1 queries, avg query time (ms): 14.680
[Timing] Total query time: 0.02 s
[Eval] Computing ground truth top-K...
[Timing] Ground truth (FAISS): 0.00 s (0.284 ms/query)
[Timing] Ground truth computation: 0.11 s
[Eval] Computing recall metrics...
[Timing] Recall evaluation: 0.01 s
[Eval] Computing (c,r)-ANN accuracy...
[Timing] FAISS r* computation: 0.00 s (0.267 ms/query)
[CR-ANN] 1/1 processed, avg time (ann.query): 13.724 ms
[Timing] (c,r)-ANN eval: 0.01 s (14.229 ms/query)
[Sanity Check] Total Relevant = 1
[Timing] (c,r)-ANN evaluation: 0.02 s
[Result] Memory breakdown (MB): {'hash_functions_MB': 3.6280059814453125, 'bucket_ids_MB': 0.7519111633300781, 'num_ids': 197109, 'num_buckets': 37082, 'hash_tables_overhead_MB': 3.1120452880859375, 'total_MB': 7.491962432861328}
[Result] Epsilon-recall: 1.0000
[Result] (c,r)-ANN accuracy: 1.0000

[Timing Summary]
  Insert phase: 2.61 s
  Query phase: 0.02 s
  Ground truth: 0.11 s
  Recall eval: 0.01 s
  (c,r)-ANN eval: 0.02 s
  Total time: 2.77 s
[SUMMARY] r=1.0, eps=0.5, eta=0.3, recall=1.0000, (c,r)-ANN accuracy=1.0, memory=7.491962432861328
