[Init] Inputs : eta=0.60, epsilon=0.50, r=1.00
[Init] LSH Parameters : w=3.154, p1=0.7472, p2=0.6267, rho=0.6236
[Init] Data Structure Parameters : k=20, L=363, key_bits=640, mode=speed
[Build] Starting insertion...
[Build] Inserted 100/8000 points, avg insert time (ms): 0.050
[Build] Inserted 200/8000 points, avg insert time (ms): 0.001
[Build] Inserted 300/8000 points, avg insert time (ms): 0.052
[Build] Inserted 400/8000 points, avg insert time (ms): 0.001
[Build] Inserted 500/8000 points, avg insert time (ms): 0.095
[Build] Inserted 600/8000 points, avg insert time (ms): 0.001
[Build] Inserted 700/8000 points, avg insert time (ms): 0.047
[Build] Inserted 800/8000 points, avg insert time (ms): 0.052
[Build] Inserted 900/8000 points, avg insert time (ms): 0.001
[Build] Inserted 1000/8000 points, avg insert time (ms): 0.001
[Build] Inserted 1100/8000 points, avg insert time (ms): 0.001
[Build] Inserted 1200/8000 points, avg insert time (ms): 0.001
[Build] Inserted 1300/8000 points, avg insert time (ms): 0.001
[Build] Inserted 1400/8000 points, avg insert time (ms): 0.001
[Build] Inserted 1500/8000 points, avg insert time (ms): 0.001
[Build] Inserted 1600/8000 points, avg insert time (ms): 0.001
[Build] Inserted 1700/8000 points, avg insert time (ms): 0.104
[Build] Inserted 1800/8000 points, avg insert time (ms): 0.001
[Build] Inserted 1900/8000 points, avg insert time (ms): 0.045
[Build] Inserted 2000/8000 points, avg insert time (ms): 0.001
[Build] Inserted 2100/8000 points, avg insert time (ms): 0.001
[Build] Inserted 2200/8000 points, avg insert time (ms): 0.040
[Build] Inserted 2300/8000 points, avg insert time (ms): 0.001
[Build] Inserted 2400/8000 points, avg insert time (ms): 0.001
[Build] Inserted 2500/8000 points, avg insert time (ms): 0.001
[Build] Inserted 2600/8000 points, avg insert time (ms): 0.001
[Build] Inserted 2700/8000 points, avg insert time (ms): 0.040
[Build] Inserted 2800/8000 points, avg insert time (ms): 0.082
[Build] Inserted 2900/8000 points, avg insert time (ms): 0.040
[Build] Inserted 3000/8000 points, avg insert time (ms): 0.042
[Build] Inserted 3100/8000 points, avg insert time (ms): 0.045
[Build] Inserted 3200/8000 points, avg insert time (ms): 0.001
[Build] Inserted 3300/8000 points, avg insert time (ms): 0.001
[Build] Inserted 3400/8000 points, avg insert time (ms): 0.001
[Build] Inserted 3500/8000 points, avg insert time (ms): 0.001
[Build] Inserted 3600/8000 points, avg insert time (ms): 0.001
[Build] Inserted 3700/8000 points, avg insert time (ms): 0.001
[Build] Inserted 3800/8000 points, avg insert time (ms): 0.047
[Build] Inserted 3900/8000 points, avg insert time (ms): 0.001
[Build] Inserted 4000/8000 points, avg insert time (ms): 0.001
[Build] Inserted 4100/8000 points, avg insert time (ms): 0.044
[Build] Inserted 4200/8000 points, avg insert time (ms): 0.041
[Build] Inserted 4300/8000 points, avg insert time (ms): 0.001
[Build] Inserted 4400/8000 points, avg insert time (ms): 0.001
[Build] Inserted 4500/8000 points, avg insert time (ms): 0.101
[Build] Inserted 4600/8000 points, avg insert time (ms): 0.001
[Build] Inserted 4700/8000 points, avg insert time (ms): 0.001
[Build] Inserted 4800/8000 points, avg insert time (ms): 0.053
[Build] Inserted 4900/8000 points, avg insert time (ms): 0.001
[Build] Inserted 5000/8000 points, avg insert time (ms): 0.001
[Build] Inserted 5100/8000 points, avg insert time (ms): 0.001
[Build] Inserted 5200/8000 points, avg insert time (ms): 0.001
[Build] Inserted 5300/8000 points, avg insert time (ms): 0.001
[Build] Inserted 5400/8000 points, avg insert time (ms): 0.043
[Build] Inserted 5500/8000 points, avg insert time (ms): 0.001
[Build] Inserted 5600/8000 points, avg insert time (ms): 0.001
[Build] Inserted 5700/8000 points, avg insert time (ms): 0.001
[Build] Inserted 5800/8000 points, avg insert time (ms): 0.001
[Build] Inserted 5900/8000 points, avg insert time (ms): 0.001
[Build] Inserted 6000/8000 points, avg insert time (ms): 0.042
[Build] Inserted 6100/8000 points, avg insert time (ms): 0.040
[Build] Inserted 6200/8000 points, avg insert time (ms): 0.047
[Build] Inserted 6300/8000 points, avg insert time (ms): 0.001
[Build] Inserted 6400/8000 points, avg insert time (ms): 0.001
[Build] Inserted 6500/8000 points, avg insert time (ms): 0.039
[Build] Inserted 6600/8000 points, avg insert time (ms): 0.041
[Build] Inserted 6700/8000 points, avg insert time (ms): 0.083
[Build] Inserted 6800/8000 points, avg insert time (ms): 0.045
[Build] Inserted 6900/8000 points, avg insert time (ms): 0.001
[Build] Inserted 7000/8000 points, avg insert time (ms): 0.001
[Build] Inserted 7100/8000 points, avg insert time (ms): 0.171
[Build] Inserted 7200/8000 points, avg insert time (ms): 0.001
[Build] Inserted 7300/8000 points, avg insert time (ms): 0.001
[Build] Inserted 7400/8000 points, avg insert time (ms): 0.001
[Build] Inserted 7500/8000 points, avg insert time (ms): 0.001
[Build] Inserted 7600/8000 points, avg insert time (ms): 0.001
[Build] Inserted 7700/8000 points, avg insert time (ms): 0.047
[Build] Inserted 7800/8000 points, avg insert time (ms): 0.001
[Build] Inserted 7900/8000 points, avg insert time (ms): 0.001
[Build] Inserted 8000/8000 points, avg insert time (ms): 0.001
[Timing] Total insertion time: 0.20 s
[Build] Starting queries...
[Query] Processed 1/1 queries, avg query time (ms): 5.165
[Timing] Total query time: 0.01 s
[Eval] Computing ground truth top-K...
[Timing] Ground truth (FAISS): 0.00 s (0.598 ms/query)
[Timing] Ground truth computation: 0.10 s
[Eval] Computing recall metrics...
[Timing] Recall evaluation: 0.01 s
[Eval] Computing (c,r)-ANN accuracy...
[Timing] FAISS r* computation: 0.00 s (0.377 ms/query)
[CR-ANN] 1/1 processed, avg time (ann.query): 4.441 ms
[Timing] (c,r)-ANN eval: 0.00 s (4.824 ms/query)
[Sanity Check] Total Relevant = 1
[Timing] (c,r)-ANN evaluation: 0.01 s
[Result] Memory breakdown (MB): {'hash_functions_MB': 3.6280059814453125, 'bucket_ids_MB': 0.045696258544921875, 'num_ids': 11979, 'num_buckets': 7769, 'hash_tables_overhead_MB': 0.6520004272460938, 'total_MB': 4.325702667236328}
[Result] Epsilon-recall: 0.1200
[Result] (c,r)-ANN accuracy: 1.0000

[Timing Summary]
  Insert phase: 0.20 s
  Query phase: 0.01 s
  Ground truth: 0.10 s
  Recall eval: 0.01 s
  (c,r)-ANN eval: 0.01 s
  Total time: 0.32 s
[SUMMARY] r=1.0, eps=0.5, eta=0.6, recall=0.1200, (c,r)-ANN accuracy=1.0, memory=4.325702667236328
