[Init] Inputs : eta=0.20, epsilon=0.50, r=1.00
[Init] LSH Parameters : w=3.154, p1=0.7472, p2=0.6267, rho=0.6236
[Init] Data Structure Parameters : k=20, L=363, key_bits=640, mode=speed
[Build] Starting insertion...
[Build] Inserted 100/8000 points, avg insert time (ms): 1.117
[Build] Inserted 200/8000 points, avg insert time (ms): 0.906
[Build] Inserted 300/8000 points, avg insert time (ms): 0.654
[Build] Inserted 400/8000 points, avg insert time (ms): 0.620
[Build] Inserted 500/8000 points, avg insert time (ms): 0.836
[Build] Inserted 600/8000 points, avg insert time (ms): 0.716
[Build] Inserted 700/8000 points, avg insert time (ms): 0.768
[Build] Inserted 800/8000 points, avg insert time (ms): 1.001
[Build] Inserted 900/8000 points, avg insert time (ms): 1.083
[Build] Inserted 1000/8000 points, avg insert time (ms): 1.118
[Build] Inserted 1100/8000 points, avg insert time (ms): 0.953
[Build] Inserted 1200/8000 points, avg insert time (ms): 0.610
[Build] Inserted 1300/8000 points, avg insert time (ms): 0.447
[Build] Inserted 1400/8000 points, avg insert time (ms): 0.381
[Build] Inserted 1500/8000 points, avg insert time (ms): 1.250
[Build] Inserted 1600/8000 points, avg insert time (ms): 0.807
[Build] Inserted 1700/8000 points, avg insert time (ms): 0.780
[Build] Inserted 1800/8000 points, avg insert time (ms): 0.423
[Build] Inserted 1900/8000 points, avg insert time (ms): 0.513
[Build] Inserted 2000/8000 points, avg insert time (ms): 0.557
[Build] Inserted 2100/8000 points, avg insert time (ms): 0.641
[Build] Inserted 2200/8000 points, avg insert time (ms): 0.475
[Build] Inserted 2300/8000 points, avg insert time (ms): 0.594
[Build] Inserted 2400/8000 points, avg insert time (ms): 0.561
[Build] Inserted 2500/8000 points, avg insert time (ms): 0.643
[Build] Inserted 2600/8000 points, avg insert time (ms): 0.586
[Build] Inserted 2700/8000 points, avg insert time (ms): 0.658
[Build] Inserted 2800/8000 points, avg insert time (ms): 1.134
[Build] Inserted 2900/8000 points, avg insert time (ms): 0.690
[Build] Inserted 3000/8000 points, avg insert time (ms): 0.610
[Build] Inserted 3100/8000 points, avg insert time (ms): 1.109
[Build] Inserted 3200/8000 points, avg insert time (ms): 0.943
[Build] Inserted 3300/8000 points, avg insert time (ms): 0.923
[Build] Inserted 3400/8000 points, avg insert time (ms): 0.757
[Build] Inserted 3500/8000 points, avg insert time (ms): 0.826
[Build] Inserted 3600/8000 points, avg insert time (ms): 0.676
[Build] Inserted 3700/8000 points, avg insert time (ms): 0.733
[Build] Inserted 3800/8000 points, avg insert time (ms): 0.556
[Build] Inserted 3900/8000 points, avg insert time (ms): 0.894
[Build] Inserted 4000/8000 points, avg insert time (ms): 0.565
[Build] Inserted 4100/8000 points, avg insert time (ms): 0.494
[Build] Inserted 4200/8000 points, avg insert time (ms): 0.970
[Build] Inserted 4300/8000 points, avg insert time (ms): 0.571
[Build] Inserted 4400/8000 points, avg insert time (ms): 0.757
[Build] Inserted 4500/8000 points, avg insert time (ms): 0.600
[Build] Inserted 4600/8000 points, avg insert time (ms): 0.746
[Build] Inserted 4700/8000 points, avg insert time (ms): 0.545
[Build] Inserted 4800/8000 points, avg insert time (ms): 0.788
[Build] Inserted 4900/8000 points, avg insert time (ms): 0.654
[Build] Inserted 5000/8000 points, avg insert time (ms): 0.965
[Build] Inserted 5100/8000 points, avg insert time (ms): 0.868
[Build] Inserted 5200/8000 points, avg insert time (ms): 0.427
[Build] Inserted 5300/8000 points, avg insert time (ms): 0.607
[Build] Inserted 5400/8000 points, avg insert time (ms): 0.529
[Build] Inserted 5500/8000 points, avg insert time (ms): 0.549
[Build] Inserted 5600/8000 points, avg insert time (ms): 0.535
[Build] Inserted 5700/8000 points, avg insert time (ms): 0.455
[Build] Inserted 5800/8000 points, avg insert time (ms): 0.799
[Build] Inserted 5900/8000 points, avg insert time (ms): 0.807
[Build] Inserted 6000/8000 points, avg insert time (ms): 0.540
[Build] Inserted 6100/8000 points, avg insert time (ms): 0.657
[Build] Inserted 6200/8000 points, avg insert time (ms): 0.854
[Build] Inserted 6300/8000 points, avg insert time (ms): 0.715
[Build] Inserted 6400/8000 points, avg insert time (ms): 0.732
[Build] Inserted 6500/8000 points, avg insert time (ms): 0.945
[Build] Inserted 6600/8000 points, avg insert time (ms): 0.573
[Build] Inserted 6700/8000 points, avg insert time (ms): -15.944
[Build] Inserted 6800/8000 points, avg insert time (ms): 0.808
[Build] Inserted 6900/8000 points, avg insert time (ms): 0.888
[Build] Inserted 7000/8000 points, avg insert time (ms): 0.665
[Build] Inserted 7100/8000 points, avg insert time (ms): 0.594
[Build] Inserted 7200/8000 points, avg insert time (ms): 0.699
[Build] Inserted 7300/8000 points, avg insert time (ms): 0.718
[Build] Inserted 7400/8000 points, avg insert time (ms): 0.368
[Build] Inserted 7500/8000 points, avg insert time (ms): 0.530
[Build] Inserted 7600/8000 points, avg insert time (ms): 0.801
[Build] Inserted 7700/8000 points, avg insert time (ms): 0.478
[Build] Inserted 7800/8000 points, avg insert time (ms): 0.681
[Build] Inserted 7900/8000 points, avg insert time (ms): 0.531
[Build] Inserted 8000/8000 points, avg insert time (ms): 0.545
[Timing] Total insertion time: 4.10 s
[Build] Starting queries...
[Query] Processed 1/1 queries, avg query time (ms): 10.289
[Timing] Total query time: 0.01 s
[Eval] Computing ground truth top-K...
[Timing] Ground truth (FAISS): 0.00 s (0.303 ms/query)
[Timing] Ground truth computation: 0.11 s
[Eval] Computing recall metrics...
[Timing] Recall evaluation: 0.01 s
[Eval] Computing (c,r)-ANN accuracy...
[Timing] FAISS r* computation: 0.00 s (0.325 ms/query)
[CR-ANN] 1/1 processed, avg time (ann.query): 22.445 ms
[Timing] (c,r)-ANN eval: 0.02 s (23.044 ms/query)
[Sanity Check] Total Relevant = 1
[Timing] (c,r)-ANN evaluation: 0.03 s
[Result] Memory breakdown (MB): {'hash_functions_MB': 3.6280059814453125, 'bucket_ids_MB': 1.8084640502929688, 'num_ids': 474078, 'num_buckets': 54369, 'hash_tables_overhead_MB': 4.562828063964844, 'total_MB': 9.999298095703125}
[Result] Epsilon-recall: 1.0000
[Result] (c,r)-ANN accuracy: 1.0000

[Timing Summary]
  Insert phase: 4.10 s
  Query phase: 0.01 s
  Ground truth: 0.11 s
  Recall eval: 0.01 s
  (c,r)-ANN eval: 0.03 s
  Total time: 4.26 s
[SUMMARY] r=1.0, eps=0.5, eta=0.2, recall=1.0000, (c,r)-ANN accuracy=1.0, memory=9.999298095703125
